{
  "$schema": "https://json-schema.org/draft/2020-12/schema",
  "$id": "https://ventora.dev/motivation-engine/dossier.schema.json",
  "title": "Dossier (admission gate record)",
  "description": "Scored dossier that moves a mechanism through lifecycle gates (SPEC.md §3.3). The prose is part of the scientific record, not decoration (Option A): each axis carries a markdown rationale, and the dossier carries a markdown dissent statement and a core_condition — JSON is the single source of truth, /dossiers renders it. Thresholds enforced by the validator and the owner: to enter INCUBATING — total >= 11 AND scores.evidence.score >= 2 AND scores.safety.score >= 2; to enter CORE — additionally at least one measured effect (from our loop or public corpora), stated in core_condition.",
  "type": "object",
  "properties": {
    "$schema": { "type": "string" },
    "id": {
      "type": "string",
      "minLength": 1,
      "description": "Dossier id, e.g. DOS-LA-01"
    },
    "mechanism_id": {
      "type": "string",
      "pattern": "^[A-Z]{2}-\\d{2}$"
    },
    "scores": {
      "type": "object",
      "description": "Five scoring axes, each an integer 0–3 with its markdown rationale",
      "properties": {
        "evidence": { "$ref": "#/$defs/axis" },
        "product_applicability": { "$ref": "#/$defs/axis" },
        "measurability": { "$ref": "#/$defs/axis" },
        "orthogonality": { "$ref": "#/$defs/axis" },
        "safety": { "$ref": "#/$defs/axis" }
      },
      "required": ["evidence", "product_applicability", "measurability", "orthogonality", "safety"],
      "additionalProperties": false
    },
    "total": {
      "type": "integer",
      "minimum": 0,
      "maximum": 15,
      "description": "Sum of the five axis scores. Gate: incubating requires total >= 11 (with evidence >= 2 and safety >= 2). The validator checks total equals the sum of scores[*].score."
    },
    "core_condition": {
      "type": "string",
      "minLength": 1,
      "description": "The explicit condition under which this mechanism may be promoted to CORE — measured, not assumed."
    },
    "dissent": {
      "type": "string",
      "minLength": 1,
      "description": "Documented counter-evidence (markdown). Every dossier must address dissent — a record that can only confirm is broken (D-019)."
    },
    "evidence_sources": {
      "type": "array",
      "items": { "$ref": "#/$defs/evidenceSource" }
    },
    "verdict": {
      "type": "string",
      "enum": ["incubating", "core", "rejected", "hold"],
      "description": "Lifecycle decision this dossier supports. 'core' additionally requires at least one measured effect."
    },
    "decided_by": { "type": "string", "minLength": 1 },
    "date": {
      "type": "string",
      "pattern": "^\\d{4}-\\d{2}-\\d{2}$"
    },
    "notes": { "type": "string" },
    "flag_lowest_admitted": {
      "type": "boolean",
      "description": "Optional owner flag marking the lowest-scoring mechanism admitted to incubating (threshold total, safety by design). Owner-authored content (D-042)."
    }
  },
  "required": [
    "id",
    "mechanism_id",
    "scores",
    "total",
    "core_condition",
    "dissent",
    "evidence_sources",
    "verdict",
    "decided_by",
    "date",
    "notes"
  ],
  "additionalProperties": false,
  "$defs": {
    "axis": {
      "type": "object",
      "properties": {
        "score": {
          "type": "integer",
          "minimum": 0,
          "maximum": 3
        },
        "rationale": {
          "type": "string",
          "minLength": 1,
          "description": "Markdown justification for the score — the scientific reasoning, entered by the owner."
        }
      },
      "required": ["score", "rationale"],
      "additionalProperties": false
    },
    "evidenceSource": {
      "type": "object",
      "properties": {
        "ref": { "type": "string", "minLength": 1 },
        "doi": { "type": "string", "minLength": 1 }
      },
      "required": ["ref"],
      "additionalProperties": false
    }
  }
}
