{
  "id": "DOS-MM-15",
  "mechanism_id": "MM-15",
  "date": "2026-07-20",
  "decided_by": "owner",
  "verdict": "incubating",
  "core_condition": "at least one measured effect recorded in observed_effects from Ventora telemetry or public corpora",
  "scores": {
    "evidence": { "score": 3, "rationale": "The most experimentally developed body in S7. Mayer's programme has produced controlled studies of each principle over three decades, synthesised in the Cambridge Handbook and 'Nine Ways to Reduce Cognitive Load'. The corpus carries 49 meta-analyses and systematic reviews, including Richter, Scheiter & Eitel on signalling, Ginns on spatial and temporal contiguity, Höffler & Leutner and Berney & Bétrancourt on animation versus static images, and Mayer, Heiser & Lonn (2001) establishing the coherence effect. Principles are specific and separately tested rather than a general claim that visuals are better — which is what makes them operational." },
    "product_applicability": { "score": 3, "rationale": "Directly implementable and cross-cutting: image-carried explanation, coherence pruning, signalling, contiguity and redundancy avoidance apply to landing, onboarding, pricing and dashboard surfaces alike. Reference at scale: side-by-side documentation layouts, demonstration-led product pages, single-focus lesson screens." },
    "measurability": { "score": 3, "rationale": "Reachable proxies: task completion, time to complete, error rate, attention to primary action, conversion. The literature's own outcome — comprehension on transfer tests — is not directly available to us, which is precisely the transfer the dossier flags below." },
    "orthogonality": { "score": 2, "rationale": "Substantially downstream of CL-14 (the principles are applied load management) and adjacent to PS-13 (memory advantage of images) and PF-16 (subjective ease). Retained as a distinct L1 because its content is a set of specific, separately validated combination rules — coherence, signalling, contiguity, redundancy — that neither the capacity constraint nor the memory finding provides. Score 2 for real within-node overlap." },
    "safety": { "score": 3, "rationale": "Applying these principles serves comprehension, which is user-aligned. Three misuse vectors are blocked as hard rules: replacing required information (price, terms, limitations) with imagery; illustrative visuals that overstate what the product does; and visual-first presentation that strips text alternatives and semantic structure, which would trade one group's comprehension for another group's access. Accessibility is treated as a hard constraint rather than a preference." }
  },
  "total": 14,
  "dissent": "The strongest caution is not against the principles but against over-reading them. (1) Domain transfer: virtually the entire evidence base measures learning outcomes — comprehension and transfer tests in instructional settings — not commercial interface outcomes such as conversion, retention or willingness to pay. It is reasonable to expect comprehension gains to help those outcomes, but it is an inference, and it is the specific reason this mechanism enters incubating rather than core. (2) Richer is not better: the animation-versus-static meta-analyses report mixed and modest advantages, and Makransky et al. (2017) found that adding immersive VR to a science simulation produced more presence but *less* learning — a direct warning that engagement and comprehension can move in opposite directions. Any reading of this mechanism as 'add more media' is contradicted by its own literature. (3) Expertise reversal recurs here as in CL-14: signalling and scaffolding that help newcomers can become extraneous for experienced users. (4) The redundancy principle has documented boundary conditions — under some pacing and prior-knowledge configurations, duplicated presentation does not harm and may assist — so it is claimed as a default, not a law. Finally, a note on our own use: the popular reading of this literature as 'people prefer pictures to text' is not what it says. It says relevant images combined with concise words under specific rules outperform prose alone; precise, sequential and technical information is often better carried by text, and stripping necessary language would be a misapplication of this evidence.",
  "evidence_sources": [
    { "ref": "Mayer & Moreno (2003). Nine Ways to Reduce Cognitive Load in Multimedia Learning. Educational Psychologist 38(1).", "doi": "10.1207/S15326985EP3801_6" },
    { "ref": "Mayer (ed.) (2014). The Cambridge Handbook of Multimedia Learning.", "doi": "10.1017/CBO9781139547369" },
    { "ref": "Mayer, Heiser & Lonn (2001). Cognitive constraints on multimedia learning: When presenting more material results in less understanding. J Educational Psychology 93(1).", "doi": "10.1037/0022-0663.93.1.187" },
    { "ref": "Moreno & Mayer (1999). Cognitive principles of multimedia learning: the role of modality and contiguity. J Educational Psychology 91(2).", "doi": "10.1037/0022-0663.91.2.358" },
    { "ref": "Richter, Scheiter & Eitel (2016). Signaling text-picture relations in multimedia learning: A comprehensive meta-analysis. Educational Research Review 17.", "doi": "10.1016/j.edurev.2015.12.003" },
    { "ref": "Höffler & Leutner (2007). Instructional animation versus static pictures: A meta-analysis. Learning and Instruction 17(6).", "doi": "10.1016/j.learninstruc.2007.09.013" },
    { "ref": "Makransky, Terkildsen & Mayer (2017). Adding immersive virtual reality to a science lab simulation causes more presence but less learning. Learning and Instruction.", "doi": "10.1016/j.learninstruc.2017.12.007" }
  ],
  "notes": "Cross-checked against /corpora/evidence/MM-15.json (282 records; both pins resolved; review anchor found; meta-analysis category is the largest at 49, unusual and favourable). Cross-cutting mechanism: parent S7, emitted into every pack. Verdict INCUBATING; CORE strictly on a measured effect — which here would also constitute the first evidence that instructional findings transfer to commercial interfaces."
}
